✅ Logfire MCP instrumentation enabled
✅ Logfire HTTPX instrumentation enabled
✅ Logfire Anthropic instrumentation enabled
✅ Logfire tracing enabled - view at https://logfire.pydantic.dev/

================================================================================
Composio Agent - Claude SDK with Tool Router
Logfire tracing enabled for observability.
================================================================================

✅ Non-blocking input handler installed (Fix 1)
⏳ Starting Composio Session initialization...
⏳ Discovering connected apps...
✅ Composio Session Created
✅ Discovered Active Composio Apps: ['codeinterpreter', 'composio_search', 'filetool', 'gmail', 'google_maps', 'googlephotos', 'googlesheets', 'linear', 'slack', 'sqltool', 'twitter', 'youtube']
✅ Active Local MCP Tools: ['mcp__local_toolkit__crawl_parallel', 'mcp__local_toolkit__read_local_file', 'mcp__local_toolkit__write_local_file', 'mcp__local_toolkit__list_directory', 'mcp__local_toolkit__upload_to_composio', 'mcp__local_toolkit__workbench_download', 'mcp__local_toolkit__workbench_upload']
✅ External MCP Servers: ['edgartools', 'video_audio', 'youtube', 'zai_vision']
✅ Discovered Skills: ['skill-creator', 'webapp-testing', 'docx', 'pptx', 'pdf', 'frontend-design', 'xlsx', 'image-generation', 'mcp-builder']
🧠 Injected Core Memory Context (1033 chars)
✅ Injected Session Workspace: /home/kjdragan/lrepos/universal_agent/AGENT_RUN_WORKSPACES/session_20260102_104332
✅ Injected Knowledge Base (6005 chars)

=== Composio Session Info ===
Session URL: https://backend.composio.dev/tool_router/trs_t3speHiLWZ8A/mcp
User ID: pg-test-8c18facc-7f25-4693-918c-7252c15d36b2
Run ID: deb3de4f-734e-472a-9914-77b74feabe9b
Timestamp: 20260102_104332
Trace ID: 019b7f986570af50fdc524a39e4e098f
Resume Command: uv run python src/universal_agent/main.py --resume --run-id deb3de4f-734e-472a-9914-77b74feabe9b
============================

================================================================================
Composio Agent Ready
================================================================================

✅ Resume checkpoint loaded: bbba78b3-eb9a-495e-9c95-c3604abd2234
✅ Resume packet constructed
run_id: deb3de4f-734e-472a-9914-77b74feabe9b
checkpoint_id: bbba78b3-eb9a-495e-9c95-c3604abd2234
current_step: 1
current_phase: unspecified
recent_tool_calls:
- bash | running | ded186d80c0555d851c862d4873146e159298e964c96249bb1a218682f687ec1
in_flight_tool_calls:
- bash | running | ded186d80c0555d851c862d4873146e159298e964c96249bb1a218682f687ec1

🤔 Query Classification: COMPLEX (Model logic: COMPLEX...)

================================================================================
[ITERATION 1] Sending: Durability test with clear interrupt point. Step 1: Call the Bash/Code tool with command `sleep 30` ...
================================================================================

🏭 CODE EXECUTION [Bash] +8.383s
   Input size: 156 bytes
   Input: {
  "command": "ps aux | grep -E \"sleep.*30\" | grep -v grep || echo \"No sleep process found\"",
  "description": "Check if sleep 30 process is still running"
}

📦 Tool Result (74 bytes) +8.618s
   Preview: kjdragan 13149  0.0  0.0   3124  1792 pts/0    S+   10:42   0:00 sleep 300

🏭 CODE EXECUTION [Bash] +12.62s
   Input size: 73 bytes
   Input: {
  "command": "date -Iseconds",
  "description": "Get current ISO timestamp"
}

🏭 CODE EXECUTION [Bash] +12.625s
   Input size: 176 bytes
   Input: {
  "command": "mkdir -p /home/kjdragan/lrepos/universal_agent/AGENT_RUN_WORKSPACES/session_20260102_104332/work_products",
  "description": "Ensure work_products directory exists"
}

📦 Tool Result (25 bytes) +12.721s
   Preview: 2026-01-02T10:44:35-06:00

📦 Tool Result (0 bytes) +13.603s

🔧 [Write] +16.276s
   Input size: 182 bytes
   Input: {
  "file_path": "/home/kjdragan/lrepos/universal_agent/AGENT_RUN_WORKSPACES/session_20260102_104332/work_products/resume_test.txt",
  "content": "2026-01-02T10:44:35-06:00\nresume_test"
}

🏭 CODE EXECUTION [Bash] +16.28s
   Input size: 157 bytes
   Input: {
  "command": "ls -la /home/kjdragan/lrepos/universal_agent/AGENT_RUN_WORKSPACES/session_20260102_104332/",
  "description": "List workspace directory contents"
}

📦 Tool Result (142 bytes) +17.335s
   Preview: File created successfully at: /home/kjdragan/lrepos/universal_agent/AGENT_RUN_WORKSPACES/session_20260102_104332/work_products/resume_test.txt

📦 Tool Result (393 bytes) +17.434s
   Preview: total 28
drwxr-xr-x 4 kjdragan kjdragan 4096 Jan  2 10:44 .
drwxr-xr-x 5 kjdragan kjdragan 4096 Jan  2 10:43 ..
drwxr-xr-x 2 kjdragan kjdragan 4096 Jan  2 10:43 downloads
-rw-r--r-- 1 kjdragan kjdragan 1074 Jan  2 10:44 resume_packet_deb3de4f-734e-472a-9914-77b74feabe9b.md
-rw-r--r-- 1 kjdragan kjdragan 5659 Jan  2 10:44 run.log
drwxr-xr-x 3 kjdragan kjdragan 4096 Jan  2 10:44 work_products

================================================================================
=== EXECUTION SUMMARY ===
================================================================================
Execution Time: 16.179 seconds
Tool Calls: 5
🏭 Code execution was used

=== TOOL CALL BREAKDOWN ===
  🏭 Iter 1 | +   8.4s | Bash
  🏭 Iter 1 | +  12.6s | Bash
  🏭 Iter 1 | +  12.6s | Bash
     Iter 1 | +  16.3s | Write
  🏭 Iter 1 | +  16.3s | Bash
================================================================================

DONE

Durability test completed successfully. The workflow resumed from the interrupted state (Step 1 sleep was in-flight), and I proceeded with:
- **Step 2**: Created `work_products/resume_test.txt` with timestamp `2026-01-02T10:44:35-06:00` and text `resume_test`
- **Step 3**: Listed workspace directory showing `work_products/`, `downloads/`, `run.log`, and resume packet
- **Step 4**: Reporting completion

🎬 Intermediate transcript saved to /home/kjdragan/lrepos/universal_agent/AGENT_RUN_WORKSPACES/session_20260102_104332/transcript.md

================================================================================
=== JOB COMPLETE ===
Run ID: deb3de4f-734e-472a-9914-77b74feabe9b
Status: succeeded
Last side-effect receipts:
- bash | succeeded | a7b3a373da86456461e2acd65ad248d9b541d202e9db1cd4d06a0c1e8fd4b492
- Write | succeeded | a162ae8a2a227f877d86ddad9b9b5f4841f495c7f5ff477006c38429f0929d48
- bash | succeeded | 60155b4586bd8fcaf2ce4bcc96d4c8328d9c534163eb4351bd84df37d8402599
- bash | succeeded | f4171ff34526428b44f92e5328ae1de8b7fdfbd80d03e5072c7aa1cd0a449dcf
- bash | succeeded | f2352da3617e9c0e4ad4afa54ee7338a0309ef2d4364176695dd77e387e3a1fd
Summary:
DONE Durability test completed successfully. The workflow resumed from the interrupted state (Step 1 sleep was in-flight), and I proceeded with: - **Step 2**: Created `work_products/resume_test.txt` with timestamp `2026-01-02T10:44:35-06:00` and text `resume_test` - **Step 3**: Listed workspace directory showing `work_products/`, `downloads/`, `run.log`, and resume packet - **Step 4**: Reporting completion
================================================================================
